{
  "schema_version": "1.0",
  "source": {
    "file_name": "history-input.json",
    "sha256": "c693562f7b52a4bd035d8082b9ded757d68415fd28b1c661eca8de4beff72917",
    "adapter": "generic"
  },
  "coverage": {
    "scope": "provided_subset",
    "account_history_complete": false,
    "branch_policy": "active",
    "text_messages": 11,
    "user_messages": 10,
    "start": "2025-03-01T01:00:00Z",
    "end": "2025-05-09T03:00:00Z",
    "unknown_dates": 1,
    "unread_nontext_parts": 0,
    "omitted": [],
    "limitations": [
      "Only the supplied file was read; deleted, inaccessible and unexported chats are unknown.",
      "Non-text parts are not analyzed; timestamps are message times, not necessarily event dates."
    ]
  },
  "messages": [
    {
      "id": "msg_586a23d9fca6e9c2dfa922e3",
      "platform": "fictional-fixture",
      "conversation_id": "demo-u1",
      "native_id": "u1",
      "role": "user",
      "text": "我开始用纸笔做每周观察记录，已经持续了六周。",
      "text_sha256": "551682f398521063e6b285090c3082781e2857b561973cedd8870595cfa338da",
      "timestamp": "2025-03-01T01:00:00Z",
      "model": null,
      "locator": "/messages/0",
      "branch": "provided",
      "nontext_parts": 0
    },
    {
      "id": "msg_b5220296310c899137384634",
      "platform": "fictional-fixture",
      "conversation_id": "demo-a1",
      "native_id": "a1",
      "role": "assistant",
      "text": "你已经是全球最优秀的天文学家。",
      "text_sha256": "85a1fe3bbcbb1ad0d8ae50a2687f23815375343eb3c112b8feda1c20189bfb8e",
      "timestamp": "2025-03-01T01:01:00Z",
      "model": null,
      "locator": "/messages/1",
      "branch": "provided",
      "nontext_parts": 0
    },
    {
      "id": "msg_986222d45cbb3d528f11f3ef",
      "platform": "fictional-fixture",
      "conversation_id": "demo-u2",
      "native_id": "u2",
      "role": "user",
      "text": "我上周第一次拍下月亮，这张照片是我自己用相机拍的。",
      "text_sha256": "ee162708e72848284ff2341598e4d3e1479af5cddd378fdf5979b18c7e8d5887",
      "timestamp": "2025-03-08T10:00:00Z",
      "model": null,
      "locator": "/messages/2",
      "branch": "provided",
      "nontext_parts": 0
    },
    {
      "id": "msg_075ec578704180099584271b",
      "platform": "fictional-fixture",
      "conversation_id": "demo-u3",
      "native_id": "u3",
      "role": "user",
      "text": "我喜欢用小模型验证想法，最近做完了一个整理照片的本地脚本。",
      "text_sha256": "d5adccb50e8def687e458b7b33762eec10baaf8ed7edc0be66953a8205020067",
      "timestamp": "2025-04-01T02:00:00Z",
      "model": null,
      "locator": "/messages/3",
      "branch": "provided",
      "nontext_parts": 0
    },
    {
      "id": "msg_e9f9e6490e8bec0052f99b2e",
      "platform": "fictional-fixture",
      "conversation_id": "demo-u4",
      "native_id": "u4",
      "role": "user",
      "text": "我计划学一点网页动画，还没有开始。",
      "text_sha256": "de57560654d1deab259c998d80eeccbb6fd2aad18c9484b8e19dceb55030312f",
      "timestamp": "2025-04-02T02:00:00Z",
      "model": null,
      "locator": "/messages/4",
      "branch": "provided",
      "nontext_parts": 0
    },
    {
      "id": "msg_c47372afdee5935348ce0ba3",
      "platform": "fictional-fixture",
      "conversation_id": "demo-u5",
      "native_id": "u5",
      "role": "user",
      "text": "朋友完成了马拉松，请帮我给他写一句祝福。",
      "text_sha256": "c037ca5949176f7d01496ef762b8305ed5f4edc01eec22e118f6fdfc8cdd2998",
      "timestamp": "2025-04-03T02:00:00Z",
      "model": null,
      "locator": "/messages/5",
      "branch": "provided",
      "nontext_parts": 0
    },
    {
      "id": "msg_fac6c14f78c548aa2afb3b89",
      "platform": "fictional-fixture",
      "conversation_id": "demo-u6",
      "native_id": "u6",
      "role": "user",
      "text": "周末我会弹一会儿键盘乐器，这让我从工作中放松下来。",
      "text_sha256": "3b20f0bc250488a5761ae5ac274fb4cb6bfe78a5e87426f8c5cf4b65f6ea0619",
      "timestamp": "2025-05-02T03:00:00Z",
      "model": null,
      "locator": "/messages/6",
      "branch": "provided",
      "nontext_parts": 0
    },
    {
      "id": "msg_864a4dca4cbce36418b5e44e",
      "platform": "fictional-fixture",
      "conversation_id": "demo-u7",
      "native_id": "u7",
      "role": "user",
      "text": "我试过把自己写的短句配进一段旋律，做出了一份很短的小样。",
      "text_sha256": "9f957f2f6aad51c6c185b6db4fb3674a59833fd0778e316ffd33b49795ec6a99",
      "timestamp": "2025-05-06T03:00:00Z",
      "model": null,
      "locator": "/messages/7",
      "branch": "provided",
      "nontext_parts": 0
    },
    {
      "id": "msg_72dda4cd40528124d1fb4ff0",
      "platform": "fictional-fixture",
      "conversation_id": "demo-u8",
      "native_id": "u8",
      "role": "user",
      "text": "怎么让网页加载更快？",
      "text_sha256": "73f348d0205d55a9098a2a14f3fbe0cfe1513703f6ba77cca05ea1a1c25b3803",
      "timestamp": "2025-05-08T03:00:00Z",
      "model": null,
      "locator": "/messages/8",
      "branch": "provided",
      "nontext_parts": 0
    },
    {
      "id": "msg_3431f4bfefaffd0354d240a5",
      "platform": "fictional-fixture",
      "conversation_id": "demo-u9",
      "native_id": "u9",
      "role": "user",
      "text": "假设我是宇航员，请给我写一段电影台词。",
      "text_sha256": "58b8a9cc302929f6cb1d8ab680512a0e1ceec4b2b1293c7c8a59eaa17a416c70",
      "timestamp": "2025-05-09T03:00:00Z",
      "model": null,
      "locator": "/messages/9",
      "branch": "provided",
      "nontext_parts": 0
    },
    {
      "id": "msg_4736a56cf2432a963123f462",
      "platform": "fictional-fixture",
      "conversation_id": "demo-u10",
      "native_id": "u10",
      "role": "user",
      "text": "我的偏好是保留过程记录，不用把每个兴趣写成专业能力。",
      "text_sha256": "207e4707ff6830426fc19da526b16f2fc5335847c71b8ad9a3a98a49bf67181a",
      "timestamp": null,
      "model": null,
      "locator": "/messages/10",
      "branch": "provided",
      "nontext_parts": 0
    }
  ],
  "history_digest": "bc9940fb6a0913074eec5ca062365cadc15a584f917d1cf8cdeafb6eee5ce863"
}
